{"$schema":"https://json-schema.org/draft/2020-12/schema","$id":"wiki-search-execution-gate-v1","type":"object","required":["protocol","decision","checks","counts","inputs_sha256"],"properties":{"protocol":{"const":"wiki-search-execution-gate-v1"},"decision":{"enum":["PASS","PARTIAL","BLOCKED"]},"checks":{"type":"object"},"counts":{"type":"object"},"allow_partial":{"type":"boolean"},"inputs_sha256":{"type":"object"}},"additionalProperties":false}
